<!ELEMENT feedbacks (feedback+)>
<!ELEMENT feedback (name, event, rating)>
<!ELEMENT name (#PCDATA)>
<!ELEMENT event (#PCDATA)>
<!ELEMENT rating (#PCDATA)>
